{
  "$schema": "https://json-schema.org/draft/2020-12/schema",
  "$id": "https://github.com/AsaZhou923/dual-agent-system/contracts/mac-job-v1-system.schema.json",
  "title": "Dual Agent mac-job/v1 system profile",
  "description": "Strict policy-v2 intersection accepted by the pinned Windows Lead and Mac Runner revisions.",
  "type": "object",
  "additionalProperties": false,
  "required": [
    "schema",
    "job_id",
    "attempt",
    "repo_id",
    "base_sha",
    "target_sha",
    "task_type",
    "focus",
    "policy_version",
    "permission_profile",
    "capabilities",
    "scope",
    "network",
    "verification_profiles",
    "deadline_seconds",
    "supervisor",
    "execution_route",
    "preferred_worker",
    "required_capabilities"
  ],
  "properties": {
    "schema": {
      "type": "string",
      "enum": [
        "mac-job/v1"
      ]
    },
    "job_id": {
      "type": "string",
      "pattern": "^[A-Za-z0-9][A-Za-z0-9._-]{2,127}$"
    },
    "attempt": {
      "type": "integer",
      "minimum": 1,
      "maximum": 1000000
    },
    "repo_id": {
      "type": "string",
      "pattern": "^[A-Za-z0-9._-]{1,64}$"
    },
    "base_sha": {
      "type": "string",
      "pattern": "^[0-9a-f]{40}$"
    },
    "target_sha": {
      "type": "string",
      "pattern": "^[0-9a-f]{40}$"
    },
    "task_type": {
      "type": "string",
      "enum": [
        "review",
        "analyze",
        "fix",
        "prepare",
        "self-update",
        "test",
        "sync"
      ]
    },
    "focus": {
      "type": "array",
      "items": {
        "type": "string",
        "minLength": 1,
        "maxLength": 256
      },
      "minItems": 1,
      "maxItems": 32
    },
    "policy_version": {
      "const": 2
    },
    "permission_profile": {
      "type": "string",
      "enum": [
        "observe",
        "standard-worktree",
        "operational",
        "privileged"
      ]
    },
    "capabilities": {
      "type": "array",
      "items": {
        "type": "string",
        "enum": [
          "sync-registered-repo",
          "prepare-registered-repo",
          "push-task-branch",
          "manage-pr",
          "install-user-tool",
          "restart-user-service",
          "self-update-runner"
        ]
      },
      "uniqueItems": true,
      "maxItems": 1
    },
    "scope": {
      "type": "object",
      "additionalProperties": false,
      "required": [
        "root"
      ],
      "properties": {
        "root": {
          "type": "string",
          "enum": [
            "metadata-only",
            "worktree",
            "registered-checkout"
          ]
        },
        "paths": {
          "type": "array",
          "items": {
            "type": "string",
            "minLength": 1,
            "maxLength": 512
          },
          "maxItems": 128
        }
      }
    },
    "network": {
      "type": "object",
      "additionalProperties": false,
      "required": [
        "mode"
      ],
      "properties": {
        "mode": {
          "type": "string",
          "enum": [
            "none",
            "declared-remotes-and-registries"
          ]
        }
      }
    },
    "verification_profiles": {
      "type": "array",
      "items": {
        "type": "string",
        "pattern": "^[A-Za-z0-9._-]{1,64}$"
      },
      "minItems": 1,
      "maxItems": 32
    },
    "owner_approval": {
      "type": "object",
      "additionalProperties": false,
      "required": [
        "approved_by",
        "approval_ref",
        "approved_at",
        "summary"
      ],
      "properties": {
        "approved_by": {
          "type": "string",
          "pattern": "^[0-9a-f]{64}$"
        },
        "approval_ref": {
          "type": "string",
          "minLength": 1,
          "maxLength": 512
        },
        "approved_at": {
          "type": "string",
          "format": "date-time"
        },
        "summary": {
          "type": "string",
          "minLength": 1,
          "maxLength": 1000
        }
      }
    },
    "deadline_seconds": {
      "type": "integer",
      "minimum": 1,
      "maximum": 86400
    },
    "supervisor": {
      "type": "string",
      "enum": [
        "mac-codex"
      ]
    },
    "execution_route": {
      "type": "string",
      "enum": [
        "auto",
        "ornith",
        "codex"
      ]
    },
    "preferred_worker": {
      "type": "string",
      "enum": [
        "ornith",
        "codex"
      ]
    },
    "required_capabilities": {
      "type": "array",
      "items": {
        "type": "string",
        "pattern": "^[A-Za-z0-9._:-]{1,64}$"
      },
      "maxItems": 32
    },
    "context": {
      "type": "object"
    },
    "extensions": {
      "type": "object"
    }
  },
  "allOf": [
    {
      "if": {
        "properties": {
          "permission_profile": {
            "const": "observe"
          }
        }
      },
      "then": {
        "properties": {
          "capabilities": {
            "maxItems": 0
          },
          "scope": {
            "properties": {
              "root": {
                "enum": [
                  "metadata-only",
                  "worktree"
                ]
              }
            }
          },
          "network": {
            "properties": {
              "mode": {
                "const": "none"
              }
            }
          }
        },
        "not": {
          "required": [
            "owner_approval"
          ]
        }
      }
    },
    {
      "if": {
        "properties": {
          "capabilities": {
            "contains": {
              "const": "self-update-runner"
            }
          }
        }
      },
      "then": {
        "properties": {
          "task_type": {
            "const": "self-update"
          },
          "permission_profile": {
            "const": "privileged"
          },
          "network": {
            "properties": {
              "mode": {
                "const": "declared-remotes-and-registries"
              }
            }
          },
          "execution_route": {
            "const": "auto"
          },
          "verification_profiles": {
            "const": [
              "self-update-runner"
            ]
          }
        }
      }
    },
    {
      "if": {
        "properties": {
          "permission_profile": {
            "const": "standard-worktree"
          }
        }
      },
      "then": {
        "properties": {
          "capabilities": {
            "maxItems": 0
          },
          "scope": {
            "properties": {
              "root": {
                "const": "worktree"
              }
            }
          },
          "network": {
            "properties": {
              "mode": {
                "const": "none"
              }
            }
          },
          "execution_route": {
            "enum": [
              "auto",
              "codex"
            ]
          }
        },
        "not": {
          "required": [
            "owner_approval"
          ]
        }
      }
    },
    {
      "if": {
        "properties": {
          "permission_profile": {
            "const": "operational"
          }
        }
      },
      "then": {
        "properties": {
          "capabilities": {
            "minItems": 1,
            "maxItems": 1
          },
          "scope": {
            "properties": {
              "root": {
                "const": "registered-checkout"
              }
            }
          },
          "execution_route": {
            "const": "auto"
          }
        },
        "not": {
          "required": [
            "owner_approval"
          ]
        }
      }
    },
    {
      "if": {
        "properties": {
          "permission_profile": {
            "const": "privileged"
          }
        }
      },
      "then": {
        "required": [
          "owner_approval"
        ],
        "properties": {
          "capabilities": {
            "minItems": 1,
            "maxItems": 1
          },
          "scope": {
            "properties": {
              "root": {
                "const": "registered-checkout"
              }
            }
          },
          "execution_route": {
            "const": "auto"
          }
        }
      }
    },
    {
      "if": {
        "properties": {
          "capabilities": {
            "contains": {
              "const": "prepare-registered-repo"
            }
          }
        }
      },
      "then": {
        "properties": {
          "task_type": {
            "const": "prepare"
          },
          "network": {
            "properties": {
              "mode": {
                "const": "none"
              }
            }
          }
        }
      }
    },
    {
      "if": {
        "properties": {
          "capabilities": {
            "contains": {
              "enum": [
                "prepare-registered-repo",
                "restart-user-service"
              ]
            }
          }
        }
      },
      "then": {
        "properties": {
          "network": {
            "properties": {
              "mode": {
                "const": "none"
              }
            }
          }
        }
      }
    },
    {
      "if": {
        "properties": {
          "capabilities": {
            "contains": {
              "enum": [
                "sync-registered-repo",
                "push-task-branch",
                "manage-pr",
                "install-user-tool",
                "self-update-runner"
              ]
            }
          }
        }
      },
      "then": {
        "properties": {
          "network": {
            "properties": {
              "mode": {
                "const": "declared-remotes-and-registries"
              }
            }
          }
        }
      }
    },
    {
      "if": {
        "properties": {
          "scope": {
            "properties": {
              "root": {
                "const": "metadata-only"
              }
            }
          }
        }
      },
      "then": {
        "properties": {
          "scope": {
            "properties": {
              "paths": {
                "maxItems": 0
              }
            }
          }
        }
      }
    }
  ]
}
