{
  "schema": "mac-job/v1",
  "policy_version": 2,
  "job_id": "system-compatibility-standard-0002",
  "attempt": 1,
  "repo_id": "example-repository",
  "base_sha": "0000000000000000000000000000000000000000",
  "target_sha": "0000000000000000000000000000000000000000",
  "task_type": "fix",
  "focus": [
    "bounded-change"
  ],
  "permission_profile": "standard-worktree",
  "capabilities": [],
  "scope": {
    "root": "worktree"
  },
  "network": {
    "mode": "none"
  },
  "verification_profiles": [
    "backend-unit"
  ],
  "deadline_seconds": 1800,
  "supervisor": "mac-codex",
  "execution_route": "auto",
  "preferred_worker": "ornith",
  "required_capabilities": []
}
