{
  "schema": "mac-job/v1",
  "policy_version": 2,
  "job_id": "system-compatibility-operational-0002",
  "attempt": 1,
  "repo_id": "example-repository",
  "base_sha": "0000000000000000000000000000000000000000",
  "target_sha": "0000000000000000000000000000000000000000",
  "task_type": "sync",
  "focus": [
    "registered-checkout"
  ],
  "permission_profile": "operational",
  "capabilities": [
    "sync-registered-repo"
  ],
  "scope": {
    "root": "registered-checkout"
  },
  "network": {
    "mode": "declared-remotes-and-registries"
  },
  "verification_profiles": [
    "git-sync-verify"
  ],
  "deadline_seconds": 1800,
  "supervisor": "mac-codex",
  "execution_route": "auto",
  "preferred_worker": "ornith",
  "required_capabilities": []
}
